wav_filename,transcription_riva,transcription_deepspeech,transcription_aws,transcription_human1,annotator_1,gender_1,audio_language_1,audio_quality_1,additional_notes_1,annotation_id_1,transcription_human2,annotator_2,gender_2,audio_language_2,audio_quality_2,additional_notes_2,annotation_id_2,country,city,station,datetime
namibia_windhoek_EagleFM_2021-09-25T02.30.02_8.wav,have to do with economics because when you go to a hotel remember that you need to pay and the cost associated with this is that it costs up to 2000 euro thousand $400 how much is that in a million dollars ,Have to do with economy because when we were to outarmed that you need to pay and dareport associate this is that it courteous and nero two thousand funerals dies how much is that in amiens,"Have to do with economies because when you go to a hotel, remember that you need to pay. And the costs associated with this is that it costs up to €2000 or $2400. How much is that in a million dollars?
","<UNKNOWN> to do with economies because when you go to a hotel, remember that you need to pay and that cost associated <UNKNOWN> 2000 euros, 2400 US dollars, how much is that in Namibian dollars",1,Male,English,Good,,119,"Have to do with economies. Because when you go to a hotel, remember you need to pay and the cost associated with it, cost up to EUR 2.000, USD 2400. How much is it in Namibian dollars?",16,Male,English,Okay,,620,Namibia,Windhoek,EagleFM,2021-09-25T02.30.02
kenya_nairobi_MeruFM_2021-09-05T15.40.01_9.wav,kata shibor japs nando core i tell you more he attended konjac makara,Toothless and in city or the atellane woman the compatible to miracastle,"Oprah's nand Engineer City Already.
",,20,Male,Non-English,Good,,637,,12,Male,Non-English,Good,,237,Kenya,Nairobi,MeruFM,2021-09-05T15.40.01
nigeria_lagos_LagosTalks_2021-10-12T10.35.01_2.wav,mineral in your body and you're consuming foods that have those minerals then you are also,Mineral in your body and your consuming foods that have those minerals then you are all so,"mineral in your body and you're consuming foods that have those minerals then you are also.
","mineral in your body and you're consuming foods that have those those minerals, then you're also",6,Female,English,Good,,388,A mineral in your body and you are consuming foods that have those minerals then you are also,10,Female,English,Good,,152,Nigeria,Lagos,LagosTalks,2021-10-12T10.35.01
kenya_nairobi_HBRRadio_2021-09-10T04.00.02_3.wav,and movie fans have been given their 1st full taste of the 4th installment in the matrix franchise in a trailer that reintroduces kan reeves hero neo the matrix resurrection will be released in cinemas and on the hbo mark streaming service in december ,And while on something given the first four taste of the fourteen torment in the matrix front as in a trailer the tree introduces an reeves her one the metric resurrection solidest in cinemas and only had to be a mark trimming salvain december,"And move the funds have been given their first full taste of the fourth installment in the Matrix franchise. In a trailer that reintroduces keanu Reeves hero Neo. The Matrix Resurrections will be released in cinemas and on the HBO Mark streaming service in december.
",And moving from <UNKNOWN> past 4 days of the 4th installment in the Matrix franchise in a trailer that reintroduces Keanu Reaves hero Neo. The Matrix Resurrection will be released in cinemas and on the HBO Max Streaming service in December,2,Male,English,Okay,,589,An movie fans have been given their first full taste of the forth installment in the matrix franchsie in  a trailer that introduces Keenu Reaves hero Neo. The matrix resurrection will be released in cinemas and will be also in HBOMax streaming service inDecember ,20,Male,English,Good,,558,Kenya,Nairobi,HBRRadio,2021-09-10T04.00.02
rwanda_kigali_KTRadio_2021-04-16T09.50.01_4.wav,quit in the coan mao susana yoga jeffer k,Kennicott when metoosin educate for cora ,"Quitting the job to determine its gender, you're gonna meet Tara Jafar cora.
",,1,,,,,16,,2,,Non-English,,,500,Rwanda,Kigali,KTRadio,2021-04-16T09.50.01
south_africa_cape_town_HeartFM_2021-09-20T15.00.01_9.wav,there's this expectation that the bank will eventually start to raise the interest rates you'll remember back in 2020 the bank reduced those interest rates in a bid to support the struggling economy affected by covid one nine the rao rate or repo rate is currently at 3.5 % ,Is this expectation of the bank eventually start to raise the interest rates you remember back in twenty twenty a banque those interest rates in a bit of a port the struggling in conomy affected by covert lenten the rapier is commonly at three point five per cent,"There's this expectation that the bank will eventually start to raise the interest rates. You'll remember back in 2020, the bank reduced those interest rates in a bid to support the struggling economy affected by COVID-19. The repository or repo rate is currently at 3.5%.
","This is expectation of the bank will eventually start to raise the interest rate. You remember back in 2020, the bank reduced those interest rates in the birth of support for struggling economy affected by COVID-19. Repo rate...oh repo rate is currently at 3.5%. ",16,Female,English,Good,,466,There's this expectation that the bank will eventually start to raise the interest rates. You'll remember that back in 2020 the bank reduced those interest rates in a <UNKNOWN> to support the struggling economy affected by COVID-19. <UNKNOWN> is currently at 3.5%.,2,Female,English,Good,,96,South Africa,Cape Town,HeartFM,2021-09-20T15.00.01
nigeria_lagos_NigeriaInfoLagos_2021-02-01T11.55.01_4.wav,he is really lucky see the truth is this if you take the right financial action you're going to get the right result so you talked about empowering people financially all the time,Really lucky to see the truth is this if you take the right and inaction you're going to get the right result so you talk about em paring people financially to or the time,"What is really lucky to see the truth is this If you take the right financial action, you're going to get the right results. So you talked about empowering people financially the all the time.
","what is really lucky. See, the truth is this, if you take the right financial action, you're gonna get the right results. So, you talked about empowering people financially all the time",2,"{""choices"": [""Male"", ""Female""]}",English,Good,,517,"..is really lucky. See, the truth is this, if you take the right financial action, you're gonna get the right result. So you talked about empowering people financially the other time?",11,"{""choices"": [""Male"", ""Female""]}",English,Good,,162,Nigeria,Lagos,NigeriaInfoLagos,2021-02-01T11.55.01
south_africa_cape_town_CapeTalk_2021-02-12T14.00.01_11.wav,sma lucy gigabeat in the pretoria magistrate's court on charges of malicious damage to property and criminal injuria today,The elusive estranged wife no man goma will be he considered she appeared in the pretoria magda court on charges of malicious damage to property and arminius to day,"Minister Malu Cg Gaba is estranged wife norman Goma will be reconsidered. She appeared in the Pretoria magistrate's court on charges of malicious damage to property and criminal injury a Today.
",Minister Malusi Gigaba's estranged wife Norman Goma will be reconsidered. She appeared in the Pretoria match's court on charges of malicious damage to property in criminal jury of today,12,Male,English,Good,Not Covid Related ,208,"Minister Malusi Gigaba estranged wife, Norma Mngoma would be reconsidered. She appeared in the Pretoria Magistrates Court and charges of malicious damages to properties and crimen injury today. ",16,Male,English,Good,,333,South Africa,Cape Town,CapeTalk,2021-02-12T14.00.01
rwanda_kigali_RadioRwanda_2021-01-09T04.25.01_19.wav,aboutnica mafra uganda oaf ska makua issa yana and nostrum,As one unmalleable harmonia as if a secocoeni mononset no materials,"wanda aka issues going to.
",<UNKNOWN> ,18,Male,Non-English,Good,,434,,9,Male,Non-English,Good,,79,Rwanda,Kigali,RadioRwanda,2021-01-09T04.25.01
south_africa_durban_VumaFM_2021-02-03T04.00.01_0.wav,it's 06:00 i'm one demand a fors good morning in the headlines of this hour ziggens to continue following covid one nine protocols and opposition parties unhappy about social development c f o's return ,At six o'clock on the day when he and dave for vermontre years with morning in the headlines of his hours the garage citizens to continue for incoordinate calls an opposite opposition parties unhappy of social development s f o white,"At six o'clock at number one, demand for romano three News Good morning. In the headlines of this hours, Ogallala urges citizens to continue following Covid 19 protocols and opposition parties unhappy about social development c f o s return.
","It's six o'clock, I'm <UNKNOWN> for <UNKNOWN> news, good morning. In the headlines this hour, Zikalala urges citizens to continue following COVID-19 protocols and opposit - opposition parties unhappy about social development CFO's return.",4,Female,English,Good,,414,"It's 6 o'clock I'm <PII> for <UNKNOWN> news, good morning. In the headlines this hour, <> urges citizens to continue following COVID 19 protocols and oppo, opposition parties are unhappy about social development CFO's return.",1,,,,,11,South Africa,Durban,VumaFM,2021-02-03T04.00.01
kenya_nairobi_HBRRadio_2021-04-11T16.20.02_2.wav,hectic talk detective silence putz aki and your city is about to go up in flames ain,And to talk to decision put a long dirty and your city is about to go up in flame and in many,"Tiktok Detective silence Put as our kati and your city is about to go up in flames a genie.
",Tick tock detective Xyler .(not clear).. and your city is about to go up in flames at any time,20,Male,English,Good,,547,tic toc detective <UNKNOWN>. Put on your coat <UNKNOW> the city is about to go <UNKNOWN>,1,Male,English,Okay,,302,Kenya,Nairobi,HBRRadio,2021-04-11T16.20.02
nigeria_lagos_LagosTalks_2021-10-12T10.35.01_8.wav,sodium can find it in soy sauce just like sodium you can find it in large amounts in processed foods small amounts in milk,Confines in soy sauce just like soda you can find it a limon in process food small amounts in milk,"sodium You can find it in soy sauce just like sodium, you can find it in large amounts in processed foods, small amounts in milk may.
","Sodium can find it in soy sauce, just like sodium you can find it in large amount of processed food, small amount in milk mmm",10,Female,English,Good,,108,"Sodium you can find it in soy source just like sodium you can find it in larger amounts in processed food, smaller amounts in milk",19,Female,English,Good,,481,Nigeria,Lagos,LagosTalks,2021-10-12T10.35.01
rwanda_kigali_RadioRwanda_2021-01-29T03.05.01_10.wav,kazi najd gaan zanosar chang yauza aka karanga kao nikan,Some who casting a seeming then i will sit homoioteleuton upon a coat,"
",<UNKNOWN> ,18,Male,Non-English,Good,,423,,3,Male,Non-English,Good,,43,Rwanda,Kigali,RadioRwanda,2021-01-29T03.05.01
namibia_windhoek_EagleFM_2021-01-27T03.40.02_11.wav,while being straw are smuggled through nairobi that's what we're getting as far as i.e. contented now in nigeria criminals have kidnapped the seven children from an orphanage ,All being straw my wood through a robe as what he get as far as that is content now in nigeria criminals have kidnapped the seven children from an orphanage,"While being strong smuggled through Nairobi, that's what you're getting, as far as that is concerned now in Nigeria, criminals have kidnapped the seven Children from an orphanage.
","<UNKNOWN> are smuggled through Nairobi. That's where he's getting as far as that is concerned. Now, in Nigeria, criminals have kidnapped 7 children from an orphanage.",2,Male,English,Good,,652,all been stra uh smuggled through Nairobi. That is what we're getting as far as that is concerned. Now in Nigeria criminals have kidnapped 7 children from an orphanage,12,Male,English,Good,Not Covid Related ,292,Namibia,Windhoek,EagleFM,2021-01-27T03.40.02
nigeria_abuja_WazobiaFM_2021-08-10T17.55.01_11.wav,top any phone to block your usd profile make the no com empt your account to stashine your eye access more than banking,Any form procession made no comment you count that in your eye says more than banking made,"On top any phone to block your u s s d profile made the no come empty account, stay safe, shine your eye access more than banking.
","Top up any phone for block you USSD profile, make them <UNKNOWN>, <UNKNOWN>, shine your eyes, access more than banking",10,Male,English,Okay,,197,"<UNKNOWN> a new phone, to block your USSD profile, make a no-commit account to stay safe, shine your eye, access more than banking",6,Male,English,Good,,400,Nigeria,Abuja,WazobiaFM,2021-08-10T17.55.01
kenya_nairobi_HBRRadio_2021-01-01T06.00.01_0.wav,vs radio i'm sam latino a five month old infant is among 207 people who tested positive for covid one nine yesterday raising the country's case load to over 94400 the health ministry says 190 are kenyans and 17 are foreigners ,Radio some will if i went all the infinite among two hundred and seven people who tested positive for covenanted years to day raising the country's case lord to valenti four thousand four hundred may help ministry as a hundred and ninety a canyons and seventeen or for in,"Radio Samuel Latino, a five month old infant, is among 207 people who tested positive for COVID-19 yesterday, raising the country's caseload to over 94,000, The Health Ministry says 190 are Kenyans and 17 are foreigners.
",A 5 month old infant is among 207 people who tested positive for COVID-19 yesterday raising the country's caseload to  over 94400. The Health Ministry says 190 are Kenyans and 17 are foreigners.,14,,,,,100,radio. <UNKNOWN> is amount of 207 people who tested positive for covid 19 yesterday rising the country's case load to over 94 400. The <UNKNOWN> says a 190 are kenyans and 27 are foreigners.,1,Male,English,Good,,352,Kenya,Nairobi,HBRRadio,2021-01-01T06.00.01
kenya_nairobi_HBRRadio_2021-04-11T16.20.02_8.wav,to ensure that these cases do not overrun our health care system there is no other wayan to maliza corona,Tastes who not over oreste the is now on the way catalina,"Violence to ensure that these cases do not overrun our health care system, there is no other way to melissa corona.
",vigilance to ensure that the cases do not overrun our healthcare system. There is no other way..Catch..foreign language ...Corona ,20,"{""choices"": [""Male"", ""Female""]}","{""choices"": [""English"", ""Non-English""]}",Good,,553,<UNKNOWN> To ensure that these cases do not overrun our health care system. There is no other way. <UNKNOWN> to <UNKNOWN> corona,2,"{""choices"": [""Male"", ""Female""]}",English,Okay,,599,Kenya,Nairobi,HBRRadio,2021-04-11T16.20.02
rwanda_kigali_RadioRwanda_2021-01-29T03.05.01_1.wav,kuka hig nook najuto saba ko gmt y vi save,No but the boat nearing i do a gunbearer with chardonnette woman to nationalisation of maso,"
",,3,Male,Non-English,Good,,52,<UNKNOWN> ,18,Male,Non-English,Good,,432,Rwanda,Kigali,RadioRwanda,2021-01-29T03.05.01
nigeria_abeokuta_OgunRadioFM_2021-09-03T11.05.01_15.wav,i witnessed at the supermarket was a scene of hysteria and footage shared online which showed people flee before the sound of gus shots could be heard,A witness about the supper mates was a saint of hysteria and footsore on line which should be both flee before the son of gothic be heard,"A witness that the supermarket was a scene of hysteria and footage shared online, which showed people fleeing before the sound of gunshots could be heard.
",Our witness at the supermarket was seen of hysteria. Our footage shared online which could be a proof people fleeing before the son of <UNKNOWN> could be heard. ,16,Female,English,Bad,,592,A witness around the supermarket was a scene of hysteria of footage stored online which should be both lean before the sound of gunshot could be heard,12,Female,English,Good,Not Covid Related,256,Nigeria,Abeokuta,OgunRadioFM,2021-09-03T11.05.01
rwanda_kigali_RadioRwanda_2021-01-09T04.25.01_0.wav,chief was the cha baur j cho kim moua oza karka is up gakki avoi bygautama yo nanha chas kohan kim gugark kaia muddu haan nav kaura,She for so tell what to editorial work or he was a deterioration of goes muttereth a bear a carry of gotteridealen the one criminal or to lady rookwood oogaboo no one attached a criminal degradation the four,"Chief Oh yeah Which is Richard?
",<UNKNOWN> ,18,Female,Non-English,Good,,453,,8,,Non-English,,Not transcribed,55,Rwanda,Kigali,RadioRwanda,2021-01-09T04.25.01
rwanda_kigali_RadioRwanda_2021-08-08T20.20.01_1.wav,a little bit more when i mansa mut mga ama is,A bit more wonder of marosin with the manger and miserable,"Uh huh.
",,12,Male,Non-English,Good,,227,<UNKNOWN>,6,Male,Non-English,Good,,369,Rwanda,Kigali,RadioRwanda,2021-08-08T20.20.01
south_africa_durban_VumaFM_2021-02-03T04.00.01_6.wav,the da a believes that the premier needs to take action against his m c and she must be relieved of her duties with immediate effect the investigations need to be concluded as a matter of urgency and not drag on like others since 2009 and monies must be recovered so that the department can focus the energy and monies on providing for the most vulnerable of our community ,The da believes that the primitiae action against his mysian she must be relieved of her duties with immediate effect the investigations need to be concluded as a matron urgency and not drag on like others two thousand and nine and money must be recovered so that the department can focus the energy and money and providing for the most vulnerable of our community,"The D. A. Believes that the premier needs to take action against his M. E. C. And she must be relieved of her duties with immediate effect. The investigations need to be concluded as a matter of urgency and not drag on, like others since 2000 and nine and monies must be recovered so that the department can focus the energy and money's on providing for the most vulnerable of our community.
","the DA believes that the premier needs to take action against his MEC and she must be relieved of her duties with immediate effect. Investigations need to be concluded as a matter of urgency, and not drag on like others since 2009, and monies must be recovered so that the department can focus their energy and monies on providing for the most vulnerable of our <TRUNC>",4,Female,English,Good,,411,"the DA believes that the premier needs to take actions against his <UNKNOWN> and she must be relieved of her duties with the immediate effect. The investigations need to be concluded as a matter of urgency, and not drag on like others since 2009, and monies must be recovered so that the department can focus the energy and monies on providing for the most vulnerable of our community",1,,,,,8,South Africa,Durban,VumaFM,2021-02-03T04.00.01
namibia_windhoek_EagleFM_2021-02-18T00.15.01_3.wav,if it gets spread through the blood it can spread to any part of the body,If he gets spread through the blood it can strike to any part of the body,"If it gets spread through the blood, it can spread to any part of the body.
",If we get straight through the blood it can spread to any part of the body,2,Female,English,Good,,665,If it gift spread through the blood it can spread to any part of the body ,10,Female,English,Okay,,278,Namibia,Windhoek,EagleFM,2021-02-18T00.15.01
nigeria_abeokuta_OgunRadioFM_2021-09-03T11.05.01_6.wav,ass that vaccines were being shipped away from a continent that has the lowest vaccination rate in the world,Trains were being shipped away from a antient that has in lewes fascination rate in the world,"Realism that vaccines were being shipped away from a continent that has the lowest vaccination rates in the world.
",<UNKNOWN> that vaccines were being shipped away of our continent that has the lowest vaccination rate in the world.,16,Female,English,Okay,,564,<UNKNOWN> that vaccines were a-shift away from a continent that has the lowest vaccination rate in the world,1,Female,English,Okay,,116,Nigeria,Abeokuta,OgunRadioFM,2021-09-03T11.05.01
namibia_windhoek_EagleFM_2021-01-27T03.40.02_20.wav,one of those he has a long term,One of these he has a long term,"One of those who has a long term.
",One of <UNKNOWN> has a long term,2,Female,English,Okay,,661,"Uh, one of this she has a, a long time",10,Female,English,Okay,,282,Namibia,Windhoek,EagleFM,2021-01-27T03.40.02
nigeria_abuja_WazobiaFM_2021-08-10T17.55.01_2.wav,you're getting premium quality monro glucose d is manufactured by brand monroe limited,You are decipimur polity monopoly is manufactured by brand moralised,"You're getting premium quality Monroe glucose D is manufactured by brand Munro LTD.
",you are getting premium quality. <UNKNOWN> is manufactured by brand <UNKNOWN> limited.,4,Female,English,Good,,138,"Your <UNKNOWN> premium quality, <UNKNOWN> is manufactured by brand <UNKNOWN> limited. ",16,Female,English,Okay,,539,Nigeria,Abuja,WazobiaFM,2021-08-10T17.55.01
namibia_windhoek_EagleFM_2021-01-27T03.40.02_2.wav,that's what we're getting there according to musa fai mama in a statement he said i'm following detentions on the kenya somalia border with content and urge the two neighbours to exercise restraint and engage in dialogue in conformity with the ig led process,One of these he has a long term,"That's what we're getting there, according to Moussa Faki Mohammed in a statement, he said I'm following the tensions on the kenya Somalia border with concern and urged the two neighbors to exercise restraint and engage in dialogue in conformity with the High Guard led process.
",Thats what we are getting into according to Musaffaki Mahmed in a statement said that I am following the tensions on the Kenya Somalia border with concern and urged the two neighbors to exercise restraint and engage in dialogue and conformity with the  eyeguard led process,20,Male,English,Good,,643,That's what we're getting there according to <UNKNOWN>. In a statement he said I'm following the tensions on the Kenya Somalia border with concern and urge the two neighbors to exercise restraint and engage in dialogue in conformity with the <UNKNOWN> led process,2,Male,English,Good,,569,Namibia,Windhoek,EagleFM,2021-01-27T03.40.02
nigeria_lagos_LagosTalks_2021-10-12T10.35.01_17.wav,clearly yes i'm talking about these different minerals and how they benefit your body but because of your current health condition of course it's advisable that you stay away from,Clearly yes i'm talking about these different minerals and how they benefit your body but because of your current health condition of course is advisable that you stay away from,"Clearly, yes, I'm talking about these different minerals and how they benefit your body, but because of your current health condition and of course it's advisable that you stay away from.
","clearly yes, I am talking about this vital minerals and how they benefit your body, but because of your current health condition, off cause it is advisable that you stay away from",19,Female,English,Good,,472,"Clearly yes, I'm talking about this different minerals and how they benefit your body. But, because of your current health condition of course it's advisable that you stay away from",11,Female,English,Good,,178,Nigeria,Lagos,LagosTalks,2021-10-12T10.35.01
