wav_filename,transcription_riva,transcription_deepspeech,transcription_aws,transcription_human1,annotator_1,gender_1,audio_language_1,audio_quality_1,additional_notes_1,annotation_id_1,transcription_human2,annotator_2,gender_2,audio_language_2,audio_quality_2,additional_notes_2,annotation_id_2,country,city,station,datetime
south_africa_durban_VumaFM_2021-02-03T04.00.01_5.wav,opposition parties have expressed concerns following the return of the provincial department of social developments chief financial officer brian dabber and seven others stand accused of inflating prices for the procurement of 48000 blankets in august the cc mama has ruled that end dab returns to work and opposition parties say this is because the department is dragging its heels in presenting critical information to the standing committee on public accounts the a spokesperson on social development alma arab says the view they view that the reinstatement of the c cfo is travesty given the probe remains unresolved ,Opposition parties ever expressed concerns following the return of the provincial department of social developments chief and until officer ran up and seven others stand acused of inflating prices for the proponent of forty eight thousand blankets in august the scale has rotted returns to work an opposition party say this is because of apartment is dragging tells presenting critical information standing commotion public counts the spokes person on social development almost view the view that the reinstatement of the seas of o as a travesty given the pro remains an result,"Opposition parties have expressed concerns following the return of the provincial Department of Social Development, Chief Financial Officer BRian Daba and seven others stand accused of inflating prices for the procurement of 48,000 blankets in august. The CCM A. Has ruled that INDABA returns to work in opposition parties say this it's because the department is dragging its heels and presenting critical information to the Standing committee on public accounts. D. A. Spokesperson on Social Development Alma Rabb, says the view the view that the reinstatement of the C c. F. O as travesty given the probe remains unresolved.
","Opposition parties have expressed concerns following the return of the provincial department of social development chief financial officer <PII> and 7 others stand accused of inflating prices for the procurement of 48,000 <UNKNOWN> in August. The CCMA has ruled that <PII> returns to work, and opposition parties say that this is because the department is dragging it's heals and presenting critical information to the standing committee on public accounts. <UNKNOWN> spokesperson on social development <PII> says the view, they view, that the reinstatement of C, CFO as a travesty given the probe remains unresolved",1,,,,,9,opposition parties have expressed concerns following the return of the provincial Department of Social Development's Chief Financial Officer Brian Ndaba and seven others stand accused of inflating prices for the procurement of forty-eight thousand blankets in August. The CCMA has ruled that Ndaba return to work and opposition parties say this is because the department is dragging its heels in presenting critical information to the Standing Committee on Public Accounts. DA Spokesperson on Social Development Elma Rabe says the view -- they view that the reinstatement of the C - CFO as a travesty given that the probe remains unresolved.,4,Female,English,Good,,412,South Africa,Durban,VumaFM,2021-02-03T04.00.01
south_africa_cape_town_CapeTalk_2021-02-12T14.00.01_16.wav,showed reduced efficacy,Showed deduced if,"Showed reduced ethical.
",<TRUNC> showed reduced <TRUNC>,15,,,,,359,showed reduced efficacy,12,Male,English,Good,,203,South Africa,Cape Town,CapeTalk,2021-02-12T14.00.01
rwanda_kigali_RadioRwanda_2021-08-08T20.20.01_0.wav,agg and nb gaza had kana behan,And yet wise and never agree and a community for belinda,"
",,12,Male,Non-English,Good,,228,<UNKNOWN>,6,Male,Non-English,Good,,370,Rwanda,Kigali,RadioRwanda,2021-08-08T20.20.01
nigeria_lagos_NigeriaInfoLagos_2021-02-01T11.55.01_9.wav,don't need to appear physically all you need to do is to leverage the opportunity we provided for you the opportunity to make extra money without your physical appearance by partnering with us it's a massive opportunity for everyone so tell me and for the benefits of just listening to us right now how do we,All all in to us to leverage the opportunity with provided for you the opportunity to make a trammon without your fiscal appear as my partner with us it's a massive opportunity for every one set or me and funniments of justness in to us right now or,"You don't need to appear physically. All you need to do is to leverage the opportunity we've provided for you, the opportunity to make extra money without your physical appearance. By partnering with us. It's a massive opportunity for everyone, so tell me, and for the benefit of just listening to us right now, how do we?
","you don't need to appear physically, all you need to do is leverage the opportunity we've provided for you. the opportunity to make extra money without your physical appearance, by partnering with us. It's a massive opportunity for everyone. And tell me and for the benefit of those listening to us right now, how do",11,"{""choices"": [""Male"", ""Female""]}",English,Good,,157,"You don't need to appear physically. All you need to do is to leverage the opportunity we have provided for you. The opportunity to make extra money without your physical appearance. By partnering with us, it's a massive opportunity for everyone. So Tommy, and for the benefit of those listening to us right now, <TRUNC>",2,"{""choices"": [""Male"", ""Female""]}",English,Okay,,512,Nigeria,Lagos,NigeriaInfoLagos,2021-02-01T11.55.01
kenya_nairobi_HBRRadio_2021-04-11T16.20.02_7.wav,remember the only way to protect yourself from this new coronavirus variant is to wash your hands with soap and running water wear your mask properly and maintain social distance we must continue with this,Remember the only way to protect yourself from this new role of virus variant as to washhand it so and running water were you mask properly and maintain social distance remote,"Remember, the only way to protect yourself from this new coronavirus variant is to wash your hands with soap and running water where your mask properly and maintain social distance, we must continue with.
","Life (??) ...Remember the only way to protect yourself from this new Corona virus variant is to wash your hand with soap and running water, wear your mask properly ad maintain social distance . We must continue with the ..",20,"{""choices"": [""Male"", ""Female""]}",English,Good,,552,"Remember, the only way to protect yourself from this new coronavirus variant is to wash your hands with soap and running water, wear your mask properly, and maintain social distance. We must continue ",2,Female,English,Good,,598,Kenya,Nairobi,HBRRadio,2021-04-11T16.20.02
nigeria_abeokuta_OgunRadioFM_2021-09-03T11.05.01_14.wav,in new zealand have shot and killed a violent extremist after he stabbed and wounded at least,As alan have shot and killed a roland extremist after i stopped a wounded at least,"Place in New Zealand have shot and killed a violent extremist after he stabbed and wounded at least.
",<TRUNC> New Zealand have showed <UNKNOWN> after he stabbed and wounded at least,12,Female,English,Good,Not Covid Related ,257,Police in New Zealand have shot and killed a violent extremist after he stabbed and wounded a <UNKNOWN> ,16,Female,English,Okay,,593,Nigeria,Abeokuta,OgunRadioFM,2021-09-03T11.05.01
rwanda_kigali_RadioRwanda_2021-01-29T03.05.01_0.wav,kim we got mugabe and da tuki need a nai a caut kana hakka kuka banana karun mi tangara mo,Quillcote denominate a continent as cora but not a cocacola at aramon is in slavonian,"
",<UNKNOWN> ,18,Male,Non-English,Good,,433,,9,Male,Non-English,Good,Audio in a language other than English,58,Rwanda,Kigali,RadioRwanda,2021-01-29T03.05.01
south_africa_cape_town_CapeTalk_2021-09-11T05.50.01_4.wav,also guilty of it i was actually when you asked me to come and share about this topic i reflect on myself,Guilty of it i was actually within you ask me to come she about the stock in atonement and,"Also guilty of it, I was actually when you asked me to come and share about this topic, actually reflect on myself.
","Also guilty of it, I was actually, and you asked me to come share about this topic, I had to reflect on myself",2,,English,Bad,,200,so guilty of it. I was actually when you asked me to come and share about this stuff <UNKNOWN> myself. Hmm.,15,,,,,355,South Africa,Cape Town,CapeTalk,2021-09-11T05.50.01
kenya_kitale_RadioSafariFM_2021-08-04T03.45.01_4.wav,went down with the kym to f my own the money,But now the kidnapper and i would fleetingly keela,"Kenya, you put them there and I'm going to assemble the man in Dubai a managed reality to keep planning.
",,14,,Non-English,,Not transcribed.,69,<UNKNOWN> Kenya <UNKNOWN>,1,Male,Non-English,Okay,,338,Kenya,Kitale,RadioSafariFM,2021-08-04T03.45.01
namibia_windhoek_EagleFM_2021-09-25T02.30.02_5.wav,another epidemic come we will find enough he because he he pulled those that main behind,A man may do to me decontaminated to poelcapelle,"Another It didn't make you come we find not because here she was proud of just mainly behind.
",<UNKNOWN> because we are <UNKNOWN>,16,Male,English,Bad,,619,<UNKNOWN>,11,Male,Non-English,Okay,,189,Namibia,Windhoek,EagleFM,2021-09-25T02.30.02
kenya_nairobi_MeruFM_2021-09-05T15.40.01_6.wav,langat bout kri wagga ks in yomi iki tama ganada you gta ka domalde to unga oh what that was abukuma,That would ha bottiaea caroline he caring or my cameronian to evening it carlomein give out that he cariateen mother to evening kinda boat i don't know about the poison to me the woman i no,"You need to give that to to what.
",,2,,Non-English,,,575,,20,Male,Non-English,Good,,634,Kenya,Nairobi,MeruFM,2021-09-05T15.40.01
namibia_windhoek_EagleFM_2021-01-27T03.40.02_9.wav,organizations like the eu emergency trust fund for africa have helped to secure the release of ethiopian migrants and even going ahead to secure them employment as well,Or any rations like the images of cranford for africa have helped to secure the release of ethiopian migrants and even goahead to secure him employment as a,"Organizations like the EU Emergency Trust Fund for Africa have helped to secure the release of Ethiopian migrants and even going ahead to secure them employment as well.
",Organizations like the EU Emergency Trust Fund for Africa have helped to secure the release of Ethiopian migrants and even gone ahead to secure them employment as well,12,Male,English,Good,Not Covid Related ,294,Organizations like the EU Emergency Trust Fund for Africa have helped to secure the release of Ethiopian migrants and even going to secure them employment as well,2,Male,English,Good,,650,Namibia,Windhoek,EagleFM,2021-01-27T03.40.02
nigeria_abuja_WazobiaFM_2021-08-10T17.55.01_9.wav,be when you carry your business banking information like your bin password or even ot p s given another person you don't leave your key for gets be at all don't mind anybody will call you put and sa them they follow access bank walk or text you say make you give them your em card number pin bbn password or one time password,And toiney do when you call your bissayan for me to like you been ashore goldpiece of tenderest don't leave your deforges me at all no man anybody we call you pretender as his bank walk portentous matogee them your inimitable behind password or antipater,"Country people not sure when you carry your personal banking information like your pin password or even OTP self, give another person you don't leave your key. Forgets potato. Don't mind, anybody will call you Pete and see them. They follow access bank walk or text you say. Make you give them your A T. M. Card number, pin B V. N. Password or one time password.
","<UNKNOWN> when you carry your personal banking information like your PIN, password or even OTP server key given other person. You leave your key for gets be data. No mind anybody will call you pretend say them they follow access bank work or text you say make you give them your ATM card number, PIN, BVN, password or want them password <TRUNC>",6,Male,English,Good,,407,"<UNKNOWN> when you carry your personal banking information like your pin, password, or even OTP serve give another person. You don't use your key for <UNKNOWN>. No mind anybody will call you, pretend say them the full access bank walk, or text you say, quick you give them your ATM card number, PIN, BVN, password, or one-time password <TRUNC>",12,Male,English,Good,Pidgin/creole,64,Nigeria,Abuja,WazobiaFM,2021-08-10T17.55.01
kenya_nairobi_HBRRadio_2021-09-10T04.00.02_0.wav,don't you think 07:00 is this how we sound downs vibes and the rhythm ride it sick around some more mixes come in your way and of course don't forget to get grouches in the building or your freestyle friday as well ,To his dissolute grammar ma is coming away and of course i forget it gracie building for your free to friday as well,"seven o'clock is this how we sound? Dancehall vibes on your rhythm ride. Stick around. Some more mixes coming your way and of course, don't forget DJ Grouch is in the building with your freestyle friday as well.
","Several talk at this hour is sound. <UNKNOWN> <UNKNOWN> Stick around some more mixes coming your way and of course don't forget to the grouches in the building, freestyle friday as well",2,Male,English,Bad,,595,...7 o clock...Vibes....Take a round some warm mixings coming your way and ofcourse dont forget DJ Grouchy is in the building and DJ Freestyle as well ,20,Male,English,Good,,555,Kenya,Nairobi,HBRRadio,2021-09-10T04.00.02
rwanda_kigali_KTRadio_2021-04-16T09.50.01_1.wav,matan kya kyonan green ork are continental w jaw,Novels,"Kenya Continental by two million.
",,8,,Non-English,,Not transcribed,85,,2,,Non-English,,,503,Rwanda,Kigali,KTRadio,2021-04-16T09.50.01
nigeria_lagos_NigeriaInfoLagos_2021-02-01T11.55.01_1.wav,saw us to be able to meet up with their daily needs there's a short story of a little boy he went to his father and asked dad what is the meaning of financial freedom and the dog said when you're sleeping at home and the one is out there working for you without your time or physical presence i.e. financial freedom ,One apiece now what i'm tinker right now but if people will be interested in this great parties,"So as to be able to meet up with their daily needs. There's a short story of a little boy. He went to his father and asked Dad what is the meaning of financial freedom? And dad said, when you're sleeping at home and the one is out there working for you without your time of physical presence, That is financial freedom.
","so as to be able to meet up with there daily need, there is a short story of a little boy, he went to his father and asked, dad what is the meaning of financial freedom, and the dad said when you are sleeping at the home and money is out there working for you without you time or physical presence  that is financial freedom.",19,Male,English,Good,,469,"so as to be able to meet with our daily needs. There's a <UNKNOWN>, he went to his father and ask, ""Dad what is the meaning of financial freedom."" And the Dad said, ""When you're sleeping at home and the money is out there working for you without your time or physical presence, that is financial freedom.""",11,Male,English,Good,,165,Nigeria,Lagos,NigeriaInfoLagos,2021-02-01T11.55.01
south_africa_cape_town_CapeTalk_2021-09-11T05.50.01_13.wav,i'm creating that sense of it has to be okay because i'm okay so so to your point it's about brushing it off,In creating that seems of it it has to be a patio so since you won his bet flashing in all,"I'm creating that sense of it has to be unfair because I'm okay, so, so to your point, it's about brushing it off.
","Creating <UNKNOWN> it has to be okay because I'm okay, so to your point it's about brushing it off",2,Female,English,Okay,,168,Um I'm creating that same <UNKNOWN> . It has to be OK because I'm OK. So up to a point it's about brushing it off.,15,Female,English,Okay,,309,South Africa,Cape Town,CapeTalk,2021-09-11T05.50.01
kenya_kitale_RadioSafariFM_2021-08-04T03.45.01_13.wav,why would you to embar an atta sama ind ama wa kenya to waja so we got into an app to allow neighbor rice,Why buecbuee with him my enemy a man who cannot wake him we just to walk at toupillier,"Whatever came to embody an attack them, a CMA kenya had to watch him, which also we're getting into an up of anarchy to allow neighbor race.
",<UNKNOWN>,1,Male,Non-English,Good,,348,,14,,Non-English,,Not transcribed.,93,Kenya,Kitale,RadioSafariFM,2021-08-04T03.45.01
south_africa_cape_town_HeartFM_2021-09-20T15.00.01_15.wav,walk assistant coach dion davids confirming that chas and colby is a definite dott for the santa's match against new zealand,Wooden david sir confirming the chase an come is a deaf a dart or for the sentis mate gainst mustees,"Assistant coach Deane Davids, confirming that Chest and Colby is a definite doubt for this saturday's match against New Zealand's.
",assistant coach Deon Davidson confirming the ??? Colby is a definite ??? for the Saturday's match against New Zealanders,6,,,,,29,<TRUNC> Assistant Coach Deon Davids confirming the chase of <UNKNOWN> isn't a different dart for the Saturday's match against <UNKNOWN>,16,Male,English,Bad,,337,South Africa,Cape Town,HeartFM,2021-09-20T15.00.01
south_africa_cape_town_HeartFM_2021-09-20T15.00.01_6.wav,none of their deaths have been linked to those covid vaccines but meanwhile the head of operations in the province dr. sadik says they will continue to monitor the information ,None of the deaths have been linked to those coleraine but meanwhile they had of operations in the province damtidam says they will continue to monitor the information,"None of their deaths have been linked to those covid vaccines, but meanwhile, the head of operations in the province, doctor Sidi Karim says they will continue to monitor the information.
","None of the deaths have been linked to those COVID vaccines, but meanwhile the head of the operation in the province, Dr. Sadiq Kareem, says they will continue to monitor the information. ",16,Female,English,Good,,489,"None of their deaths have been linked to those COVID vaccines. But meanwhile the head of operations in the province, Dr. Sadik Kadim will continue to monitor the information",2,Female,English,Good,,104,South Africa,Cape Town,HeartFM,2021-09-20T15.00.01
rwanda_kigali_RadioRwanda_2021-01-09T04.25.01_16.wav,tiba hiri mu foni in jasa wum auk min quali fra at coc,For an gessoriacum quite a friend of coconino your,"
",<UNKNOWN> ,18,Male,Non-English,Good,,437,,9,Male,Non-English,Good,,92,Rwanda,Kigali,RadioRwanda,2021-01-09T04.25.01
rwanda_kigali_KTRadio_2021-04-16T09.50.01_10.wav,i shall be su when you youdo you,The sooner we deliver a hare he do you a,"Yeah sure you would have not uh.
",,8,,Non-English,,"Not English, not transcribed",61,<UNKNOWN> ,18,Male,Non-English,Good,,456,Rwanda,Kigali,KTRadio,2021-04-16T09.50.01
nigeria_ado-ekiti_EktiRadio_2021-10-08T16.40.01_0.wav,universityof management support calling for cooperation in taking the institution to the international standards,Unity of moniments opot calling for cooperation in taking the situation to the international standards,"University of Management support calling for cooperation in taking the institution to the international standards.
",university of management support calling for cooperation in taking the institution to international standards,6,Male,English,Good,,398,University of management support calling for cooperation in taking the institution to the international standards,10,Male,English,Good,,195,Nigeria,Ado-Ekiti,EktiRadio,2021-10-08T16.40.01
rwanda_kigali_RadioRwanda_2021-06-06T12.25.01_15.wav,no one avoids an hi ring of the german,No more odious in good now anita,"No Where Now You Don't Want to.
",<UNKNOWN>,6,Male,Non-English,Good,,371,Test VM,1,,,,,13,Rwanda,Kigali,RadioRwanda,2021-06-06T12.25.01
namibia_windhoek_EagleFM_2021-01-27T03.40.02_18.wav,i taking a look at more and more of the you coming through on the african continent now we take a look at what's playing out right across the world beginning with the world economic forum special addressed by the president of france that mano macron,Taking a look at more and more of the use coming through on the african continent now it aureataland out to watercress the world the beginning with the woldemar especial addressed by the president of france that manuma come the,"Are taking a look at more and more of the news coming through on the African continent. Now, we take a look at what's playing out right across the world, beginning with the World Economic Forum, a special address by the president of France. That's Emmanuel Macron there.
","I take a look at more and more of the use coming through on the African continent. Now we take a look at what is the plain out to whether cross the world, beginning with the World Economic Forum special address by the President of France, Emmanuel Macron ",10,Male,English,Good,,284,"And taking a look at more and more of the news coming through on the African continent. Now we take a look at what's playing out right across the world, beginning with the World Economic Forum, a special address by the president of France, that's Emanuel Macron",2,Male,English,Good,,659,Namibia,Windhoek,EagleFM,2021-01-27T03.40.02
rwanda_kigali_RadioRwanda_2021-06-06T12.25.01_6.wav,ku go you in the,We go to be seen at every ten ambition more so,"Could we be suing the tobacco How are you telling me you animal?
",,12,,,,,240,<UNKNOWN>,6,Male,Non-English,Good,,380,Rwanda,Kigali,RadioRwanda,2021-06-06T12.25.01
namibia_windhoek_EagleFM_2021-06-07T03.45.01_2.wav,to assure people that life had returned to normal following a number of military operations the massive attack by suspected yards came hours after another t friday evening onregion which claimed the lives of at least 14 people including an armed volunteer we had come to help them ,To a shore people with that life at recent sonoma following him number of military operations the massive attack by suspected ye tis a came hours after another that friday evening and taalat a village in the center a region which claimed the lives of at least of fourteen keeping an armed volunteer we had come to help them,"To assure people that life had returned to normal following a number of military operations, the massive attack by suspected here. This came hours after another attack Friday evening on today's Yatta village in the same region, which claimed the lives of at least 14 people, including an armed volunteer, we had come to help them see.
","To assure people what that like <UNKNOWN> to normal, following in the number of military operations the massive attacks by suspected <UNKNOWN> came out after another attack Friday evening on Tadariata village in <UNKNOWN> region which claimed the lives of at least 14 people including a volunteer with come to help them <TRUNC>",10,Male,English,Okay,,272,"to assure people that <UNKNOWN> returns to normal following a number of military operations. The massive attack was suspected <UNKNOWN> came hours after another attack Friday evening. On <UNKNOWN>, a village in the center region, which claimed the lives of at least 14 people including an armed volunteer who had come to help them",2,Male,English,Good,,669,Namibia,Windhoek,EagleFM,2021-06-07T03.45.01
namibia_windhoek_EagleFM_2021-06-07T03.45.01_11.wav,he urged all chadian to get vaccinated as the coronavirus does not discriminate by religion or ethnicity,He urged all cabins to get vaccinated as the corona virus does not discriminate by religion or is misty,"He urged all chadians to get vaccinated as the coronavirus does not discriminate by religion or ethnicity.
",He urged <UNKNOWN> to get vaccinated as the coronavirus does not discriminate by religion or ethnicity ,3,Female,English,Okay,,322,He urged all Chadians to get vaccinated and as the Coronavirus does not discriminate by religion or ethnicity. ,12,Female,English,Good,,268,Namibia,Windhoek,EagleFM,2021-06-07T03.45.01
rwanda_kigali_RadioRwanda_2021-08-08T20.20.01_8.wav,-,,"
",<UNKNOWN>,16,Male,Non-English,Bad,,532,,12,Male,Non-English,Okay,,220,Rwanda,Kigali,RadioRwanda,2021-08-08T20.20.01
rwanda_kigali_RadioRwanda_2021-01-09T04.25.01_7.wav,on the no moan raj kana bazan fang kukui kashima kuai quai what law,On redistribute but too but never what no one,"Donna Donna Donna.
",,12,Male,Non-English,Good,,249,<UNKNOWN> ,18,Male,Non-English,Good,,446,Rwanda,Kigali,RadioRwanda,2021-01-09T04.25.01
namibia_windhoek_OmulungaRadio_2021-09-24T11.30.01_1.wav,on wednesday also only recorded 36 new cases from a total of 1100 samples tested marking a positivity rate of only 3.3 % well below the w h o benchmark of 5 % ,They also recorded thirty six new cases from a to l of one thousand one hundred samples tested marking a positivity rate a one three point three per cent while below the who bench mark of five per cent,"On Wednesday also only recorded 36 new cases from a total of 1100 samples tested marking a positivity rate of only 3.3%, well below the WH. O benchmark of 5%.
","Here is on Wednesday, also a new record that 66 new cases from a total of 1100 samples tested marking a positivity rate beneath 3.3% below the WHO benchmark of 5%",16,Male,English,Good,,615,Wednesday also are you recorded 36 new cases from a total of 1100 samples tested marking a positivity rate of only 3.3% well below the WHO benchmark of 5%,1,Male,English,Good,,122,Namibia,Windhoek,OmulungaRadio,2021-09-24T11.30.01
