wav_filename,transcription_riva,transcription_deepspeech,transcription_aws,transcription_human1,annotator_1,gender_1,audio_language_1,audio_quality_1,additional_notes_1,annotation_id_1,transcription_human2,annotator_2,gender_2,audio_language_2,audio_quality_2,additional_notes_2,annotation_id_2,country,city,station,datetime
south_africa_durban_EastCoastRadio_2021-08-11T10.00.01_8.wav,after the officials having taken the decisionpublicized it that we are going to,After the officials having taken the decision than publicized in that we are being,"After the officials having taken the decision and publicize it that we are going to.
","After the officials have been taken the decisions, and publicized it that we are going to",1,,,,,22,after the officials have been taken the decision and publicized it that we are going <TRUNC>,4,Male,English,Okay,,416,South Africa,Durban,EastCoastRadio,2021-08-11T10.00.01
nigeria_abeokuta_OgunRadioFM_2021-09-03T11.05.01_4.wav,one fresh cases on thursday indicated an increase from the five and 82 cases posted on wednesday ,A fresh case is on first day and the clattered and increased from the farmer into kisses posted on wanting,"That one fresh cases on Thursday indicated an increase from the February 92 cases posted on Wednesday.
","That one fresh case on the first day indicated an increase from the February into 2 cases, posted on Wednesday.",16,Female,English,Okay,,562,<UNKNOWN> one fresh case is on first day indicated a increase from the <UNKNOWN> posted on Wednesday,1,Female,English,Okay,,118,Nigeria,Abeokuta,OgunRadioFM,2021-09-03T11.05.01
namibia_windhoek_EagleFM_2021-02-18T00.15.01_1.wav,the upper urinary tract which mainly is the kidneys and the uterit,The apparatus which mainly is the kidneys and the rat,"The upper urinary tract, which mainly is the kidneys and the ureter.
","The upper urinary tract, which mainly is the kidneys and the urethra",2,Female,English,Okay,,663,"the app urinal track, uh-huh, which mainly is the kidneys and the <TRUNC>",10,Female,English,Okay,,280,Namibia,Windhoek,EagleFM,2021-02-18T00.15.01
namibia_windhoek_EagleFM_2021-06-07T03.45.01_9.wav,following the official launched on friday of chad's covid one nine vaccination campaign with the minister of health and other officials receiving their shot to mark the occasions chadian is queued up saturday in in jana for their 1st doses of china's donated cyo farm which arrived earlier in the week ,Following the official launch on friday of child's covet nineteen vaccination campaign with the minister of health and other officials receiving their shot to mark the occasion chatons cute of saturday and intemena for their first doses of china's donated signor which arrived earlier in the week,"Following the official launch on Friday of Chats, vaccination campaign, with the Minister of Health and other officials receiving their shot to mark the occasion, Chadians queued up Saturday in N'Djamena for their first doses of China's donated sinopharm, which arrived earlier in the week.
","Following the official launch on five days of Chad's COVID 19 vaccination campaign with the Minister of Health and other officials receiving the shots to mark the occasion, Chadian's <UNKNOWN>  for the first doses of China's donated Sinopharm which arrived earlier in the week",3,Female,English,Okay,,325,Following the official launch on Friday of Chad’s Covid19 vaccination campaign with the Ministry of Health and other officials receiving their shots to mark the occasion Chadians queued up Saturday in N’djamena for their first doses of China’s donated Sinopharm which arrived earlier in the week. ,12,Female,English,Good,,290,Namibia,Windhoek,EagleFM,2021-06-07T03.45.01
nigeria_ado-ekiti_EktiRadio_2021-10-08T16.40.01_7.wav,common area of amasa so about 16 members of the community are currently hospitalized as a result of the outbreak at num general hospital and wang dispensary he lamented that the outbreak or ticket a huge toll on the residents explaining that victims of the disease died on a daily basis mostly on the day the w infected ,A mantilla of adamaua said about sixty members of the community are collectable at a result of the outbreak at numantia hospital and well on dispensary i lamented at the outbreak of ticket on the russians explained in that victims of the basis died one the lives mostly on the day the war infected,"Commenting area of Demasiado said about 16 members of the community were currently hospitalized as a result of the outbreak at Newman General Hospital. And dispensary lamented that the outbreak had taken a huge toll on the residents, explaining that victims of the disease died on a daily basis, mostly on the day they were infected.
","<TRUNC> area of Adamar are so doubted, so about 15 members of the community were currently are hospitalized as a result of the outbreak at New Mandiram Hospital and <UNKNOWN> dispensary. Ill lamented of the outbreak of taken off a huge toll on the residents explaining the victim of the disease died on daily basis mostly on the day of why infected",10,Male,English,Okay,,155,"<UNKNOWN> area of <UNKNOWN> about 16 members of community were correctly hospitalized as a result of outbreak at Numandira hospital and <UNKNOWN> dispensary lamented the outbreak had taken a huge toll on residents, explaining that victims of the disease died on the daily basis, mostly on the day they were infected",6,Male,English,Good,,391,Nigeria,Ado-Ekiti,EktiRadio,2021-10-08T16.40.01
rwanda_kigali_RadioRwanda_2021-01-09T04.25.01_6.wav,arima adria of gaunama kaabu kakazai shui t,And another of the emaciated come pentauirit barometrical as tabitha or molecules action teaches,"
",<UNKNOWN> ,18,Male,Non-English,Good,,447,,12,Male,Non-English,Okay,,250,Rwanda,Kigali,RadioRwanda,2021-01-09T04.25.01
rwanda_kigali_RadioRwanda_2021-08-08T20.20.01_7.wav,hugs anyh could you be viga here you one yeah again i fork hijmog a koku who k turkish,For in a incompetent hellebergene i resume the ferocious or october moderated as cacaracamouchen,"Uh huh.
",,12,Male,Non-English,Good,,221,Hohohoho... <UNKNOWN>,16,Male,Non-English,Good,,533,Rwanda,Kigali,RadioRwanda,2021-08-08T20.20.01
south_africa_durban_EastCoastRadio_2021-08-11T10.00.01_0.wav,terms and conditions apply this saturday east coast radio top 40 with danny is going nazor with mcdonalds tune in as danny and eas coco's radio top 40 broadcast live from mcdonald's hillcrest from 10:00 a.m. to 02:00 p.m. or come on down and get your naza on ,Terms and conditions of life the sad idays case radio top forty with danny is going now saw with macdonald's tune in as danny and his cause radiatory port costive from mac donald hillcrist from ten in to tom or come on down and get your nason,"Terms and conditions apply this saturday East Coast Radio Top 40 with Danny is going nozzle with Mcdonald's tune in as Danny and East Coast Radio Top 40 broadcast live from Mcdonald's Hillcrest from 10 am to two PM or come on down and get your nozzle on.
",Terms and conditions apply. This Saturday East Coast Radio Top 40 with Dannie is going Nazo with McDonalds. Tune in as Dannie and East Coast Radio Top 40 broadcast live from McDonalds <PII> from 10 AM to 2 PM. Oh come on down and get your Nazo on. ,16,Female,English,Good,,335,terms and conditions apply. This Saturday East Coast Radio Top 40 with Danny is going <UNKNOWN> with McDonalds. Tune in as Danny and East Coast Radio Top 40 broadcast live from McDonald's Hillcrest from 10am to 2pm or come on down and get your <UNKNOWN> on.,4,Female,English,Good,,30,South Africa,Durban,EastCoastRadio,2021-08-11T10.00.01
rwanda_kigali_RadioRwanda_2021-01-29T03.05.01_7.wav,in mugga and nab ga ariana and faa kani gang,I was to get a front and now were not got an idea not an festooned,"
",<UNKNOWN> ,18,Male,Non-English,Good,,426,,3,Male,Non-English,Good,,46,Rwanda,Kigali,RadioRwanda,2021-01-29T03.05.01
namibia_windhoek_OmulungaRadio_2021-09-24T11.30.01_0.wav,and social services in their update for wednesday 22 september recorded ten more covid one nine or covid one nine related deaths bringing the total number of people who are known to have died from the virus and its effects to 3488 none of the people who are recorded to have died had received a vaccine but in some good news the number of people who have received at least one dose now stands at over 250000 with over 165 4000 people in the country now fully vaccinated the min ,Social services in the update for winds they the and it september recorded in more covert or cover related death bringing total number of people who are known to have died from the virus and its effects to three thousand four hundred and eighty eight none of the people who are recorded to have died had received the vaccine but in some good news the number of people who have received the least one does not stand it over to it over one hundred sixty four thousand people in the country now fully vaccinated the,"Social services, in their update for Wednesday the 22nd of september recorded 10 more Covid 19 or covid 19 related deaths, bringing the total number of people who are known to have died from the virus and its effects to 3000, 488 none of the people who are recorded to have died had received the vaccine. But in some good news, the number of people who have received at least one dose now stands at over 250,000, with over 164,000 people in the country now fully vaccinated the minute.
",social services in the updates for Wednesday the 26th in September recording 10 more covid 19 or covid 19 related death pretty <UNKNOWN> total number people who are known to a die from the virus and it's a fact 23488. None of the people who are recording to a die had received the vaccine. But in some good news the number of people who have received at least one dose now stands in order of 230000 <UNKNOWN> people in the country now fully vaccinated,1,Male,English,Good,,121,"<TRUNC> social services in their update for Wednesday the 22nd of September, recorded 10 more COVID-19 or COVID-19 related deaths bringing the total number of people who are none to have died from the virus and it affects to 3488. None of the people who are recorded to have died had received the vaccines. But in some good news, a number of people who have received at least one dose now stands over 250.000 with over 164.000 people in the country now are fully vaccinated. ",16,Male,English,Good,,616,Namibia,Windhoek,OmulungaRadio,2021-09-24T11.30.01
namibia_windhoek_EagleFM_2021-06-07T03.45.01_10.wav,for the moment chad has prioritized 1st of all pilgrims over 65 health workers and the military ,The polling sundered the moment chart has prioritize first of all pilgrims over a sixty five health workers and the miller,"For the moment, Chad has prioritized, first of all pilgrims over 65 health workers and the military.
","For the moment, Chad has prioritized first of all pilgrims over 65 health workers and the ",3,Female,"{""choices"": [""English"", ""Non-English""]}",Bad,,324,For the moment Chad has prioritized first of all Pilgrims over 65 health workers and the military,12,Female,English,Good,,269,Namibia,Windhoek,EagleFM,2021-06-07T03.45.01
namibia_windhoek_EagleFM_2021-01-27T03.40.02_17.wav,a 2020 report by s b morgan nigerian geopolitical consulting firm ,At two thousand invented report by as bargain and egeria job politician them,"A 2020 Report by SB Morgen and Nigerian Geo Political Consulting Film.
",At 2020 report by SP Morgan and Nigerian job political consulting firm ,10,Male,English,Okay,,285,"A 2020 report by SP Morgan, a Nigerian geopolitical consulting firm",2,Male,English,Good,,658,Namibia,Windhoek,EagleFM,2021-01-27T03.40.02
rwanda_kigali_RadioRwanda_2021-06-06T12.25.01_5.wav,the is zakaria nezob piu china,I connections to metilulu i recuperated,"uh It's up cora positions, I'm gonna tell you hook china.
",<UNKNOWN>,6,Male,Non-English,Good,,381,,3,Male,Non-English,Good,,33,Rwanda,Kigali,RadioRwanda,2021-06-06T12.25.01
rwanda_kigali_RadioRwanda_2021-06-06T12.25.01_14.wav,buka akiko basa pugs nkokotoshaka kim duk,We put it on gottesthal adequate isidorito color whose annexing a malice cushion a shake she masonboro,"
",<UNKNOWN>,6,Male,Non-English,Good,,372,,12,Male,Non-English,Good,,229,Rwanda,Kigali,RadioRwanda,2021-06-06T12.25.01
namibia_windhoek_EagleFM_2021-06-07T03.45.01_1.wav,sohn which is a small community around 15 km from sba the main city in yaga province has been hit with numerous attacks in recent years on may 14 defense minister sheriff c and the military top brass visited saba ,Repeating his five strides consent now take you to so africa where the african nation of congress,"So on, which is a small community around 15 km from Sebha, the main city in Yaga province, has been hit with numerous attacks in recent years. On May 14, Defense Minister Cherif C and military top brass visited Ceiba.
","Sohan, which is a small communities around 15 km from Sebba the main city in Yagha province, has been hit with numerous attacks in recent years. On May 14, Defense Minister Cherif Sy and Military Tom Brads visited Sebba",2,Male,English,Okay,,668,"Solhan which is a small community around 15 km from Sebba, the main city in Yagha province has been hit with enormous attacks in recent years. On May 14, Defence Minister Cheriff Sy and top military brass visited Sebba",10,Male,English,Okay,,273,Namibia,Windhoek,EagleFM,2021-06-07T03.45.01
rwanda_kigali_KTRadio_2021-04-16T09.50.01_0.wav,hein amasa moza 2nd carp for ok nova ,She smooths among a bearskin cap for a queen ever,"He was a manga GPR cycling cup for all kinds of uh.
",,8,,Non-English,,Not transcribed,88,,2,,Non-English,,,504,Rwanda,Kigali,KTRadio,2021-04-16T09.50.01
namibia_windhoek_EagleFM_2021-01-27T03.40.02_8.wav,there are no conditions for the release of the foreigners who lack proper travel documents ethiopians have continued to move in thousands to many other countries,The acadians for the release of the foreigners are led to proper travel documents at the open have continued to move in thousands to manethe countries,"There are no conditions for the release of the foreigners will lack the proper travel documents that the Europeans have continued to move in thousands to many other countries.
",There are no conditions for the release of the foreigners who left the proper travel documents. Ethiopians have continued to move in thousands to other countries,12,Male,English,Good,No Covid Related,295,There are no conditions for the release of the foreigners who left proper travel documents. Ethiopians have continued to move in 1000s to other countries,2,Male,English,Good,,649,Namibia,Windhoek,EagleFM,2021-01-27T03.40.02
nigeria_abuja_WazobiaFM_2021-08-10T17.55.01_8.wav,big in the law and rapid wind promo all you need to do is just turn into a more empty packs of nore to stand a chance to be among 24 lucky winners of 500000 narrow each with two winners announced weekly you could also win other amazing gifts like show max and mobile subscriptions for a month ri a microwaves and much more f runs from the 29th ,In the low rapid window oh you need to do is just turnin to a more empty pass of norbanus to be among any police of five hundred thousand marry each with two winners announced me we could also in other amazing guests alike show back to moroccans for a memorial and much more a run from the twenty ,"In the Northern Rap and Wind promo, all you need to do is just turn in two or more empty packs of north to stand a chance to be among 24 lucky winners of 500,000 Naira, each with two winners announced weekly. You could also win other amazing gifts, like show max mobile subscriptions for among arrival, airport microwaves and much more promo runs from the 29.
","big in the <UNKNOWN> unwrap and win promo. All you need to do is just turn in two or more empty packs of <UNKNOWN> to stand a chance to be among 24 lucky winners of 500,000 Naira each with two winners announced immediately. You could also win other amazing gifts like Showmax mobile subscriptions for a month or <UNKNOWN> airpods, microwave and much more. Promo runs from the 29th",4,Female,English,Good,,132,"big in <UNKNOWN> unwrap and win promo. All you need to do is just turn in two or more packs of <UNKNOWN> to stand a chance to be among 24 lucky winners of 500.000 naira each with tow winners announced weekly. You could also win other amazing gifts like <UNKNOWN> mobile subscriptions for a month or a <UNKNOWN> AirPods, microwaves and much more. Promo runs from the 29",6,Female,English,Good,,406,Nigeria,Abuja,WazobiaFM,2021-08-10T17.55.01
kenya_nairobi_MeruFM_2021-09-05T15.40.01_5.wav,lai read me integrity andkai bak one of them my about to,That will to bed to me even a pretty unitarian to no come my engage but the quarantine i to mombasa to mate,"I'm going to let me interpreting and translating, you know, particularly with my mom, but said Okay, the Ultimate!
",...Let me in the pretty...,20,Male,Non-English,Okay,,633,,2,,Non-English,,,576,Kenya,Nairobi,MeruFM,2021-09-05T15.40.01
namibia_windhoek_EagleFM_2021-09-25T02.30.02_4.wav,and then the whole every the whole continent is even more even we have no time,The intimate home as the idol fundamental patient in,"Hey and then the whole the whole continent is even more you know they have no time.
","<UNKNOWN>, and then the whole <UNKNOWN>, the whole continent, <UNKNOWN> <UNKNOWN> they...they will not. ",16,Male,English,Bad,,617,and then the whole continent <UNKNOWN>,11,Male,English,Okay,,190,Namibia,Windhoek,EagleFM,2021-09-25T02.30.02
kenya_kitale_RadioSafariFM_2021-08-04T03.45.01_3.wav,sanches san and my brother miki pali yak mea hello good morning,Someone love laetitia to embark on a worn hallo good morning,"santa santa my brother um Barco Panama Warner Hello Good morning!
",Asante sana my brother. <UNKNOWN> Hello good morning.,4,Male,"{""choices"": [""English"", ""Non-English""]}",Good,,345,,14,,Non-English,,,67,Kenya,Kitale,RadioSafariFM,2021-08-04T03.45.01
south_africa_cape_town_CapeTalk_2021-09-11T05.50.01_3.wav,um but i think too much of it is toxic positivity looks like and i think we all,In a bathing too much of it is is what oceanides like i think the,"I think, but I think too much of it is what toxic positivity looks like and I think.
",um. But I think too much of it is what toxic positivity looks like,1,,,,,18,thing (laughing) um but I think too much of it is is what toxic positivity looks like and I think they all,15,Female,English,,,356,South Africa,Cape Town,CapeTalk,2021-09-11T05.50.01
rwanda_kigali_RadioRwanda_2021-01-09T04.25.01_15.wav,city the ti near begg kina cha with the nof may,She bitterly lovelace automata with the real number for marriage,"Sit of the year vega johnny with Zachary.
",,12,Male,Non-English,Good,,241,<UNKNOWN> ,18,Male,Non-English,Good,,438,Rwanda,Kigali,RadioRwanda,2021-01-09T04.25.01
south_africa_cape_town_HeartFM_2021-09-20T15.00.01_5.wav,however the provincial health department says of that number of the complaints only a hundred and six of them were classified as severe more importantly of the 22 people who died shortly after being immunized ,However the provincial health to barinas of that number or offley complaints only a hundred and six of them were classified as severe more importantly of the twenty two people who died shortly after being immunized,"However, the provincial health departments is of that number, or of the complaints, only 100 and six of them were classified as severe. More importantly, of the 22 people who died shortly after being immunized.
","However, the provincial health department says that of that number, of the complaints, only 106 of them were classified as severe. More importantly, of the 22 people who died shortly after being immunized ",2,Female,English,Good,,106,"However, the provincial health department says of that number who often complained, only 106 of them were classified classified as severe, more importantly after 22 people who died shortly after being immunized. ",16,Female,English,Okay,,490,South Africa,Cape Town,HeartFM,2021-09-20T15.00.01
south_africa_cape_town_HeartFM_2021-09-20T15.00.01_14.wav,on saturday the the new world number ones the all blacks of course coming away with a 3613 win ,On sense the new the one they all black course coming away with it than he six thirteen went,"On saturday, the New World number one is the All Blacks, of course, coming away with a 36 13 win.
",Uh on <UNKNOWN> the new world number one <UNKNOWN> scores coming away with 3613 win,16,Male,English,Bad,,460,"On Saturday, the new world number one's, the all blacks, of course coming away the 3-6-13 with",2,Male,English,Okay,sports,53,South Africa,Cape Town,HeartFM,2021-09-20T15.00.01
south_africa_cape_town_CapeTalk_2021-09-11T05.50.01_12.wav,so what also is designed to do is to make me as the person is receiving or the recipient they are,So in what i was isis designed to do his tommies the persons receiving all recipient the,"So what it also is designed to do is to make me as the person is receiving or the recipient there are.
",so what it what it also it's it's designed to do is to make me as the person is receiving or the recipient <UNKNOWN> ,15,Female,English,,,312,So what it also is designed to do is to make me as the person who is receiving or the recipient thereof,2,Female,English,Okay,,169,South Africa,Cape Town,CapeTalk,2021-09-11T05.50.01
kenya_kitale_RadioSafariFM_2021-08-04T03.45.01_12.wav,womanafa g whoever ira nation have one by area and no one so of weft niga ka example baal an c y no that jerking what i said,You know people like well and not one but i make you what i do and you shall be i know when or of what he was a neighboring the shade now as it was in no wise about in a haunted with an eating a pentagon within the now the japanese the capucine because in point,"A woman who I want to go to Gambia and Owens Oh, of PMM should be nowhere. Nigeria Zambia p yeah. It's a fun example of what I think. As I said, I don't think the government knows that everybody find a key to paco and heading back, I said.
",<UNKNOWN>,1,Male,Non-English,Good,,347,,14,,Non-English,,Not transcribed.,91,Kenya,Kitale,RadioSafariFM,2021-08-04T03.45.01
nigeria_lagos_NigeriaInfoLagos_2021-02-01T11.55.01_0.wav,day and please introduce yourself my name is kula kd a representative of freedom synergy pro thank you,And be introduced yourself to me in his curacoa representative of freedom in a depot,"Today and please introduce yourself, My name is Cool, you can be a representative of Freedom Synergy Pro. Thank you.
","Introduce your self, my name is Kulia Akothee a representative of freedom ",19,Male,English,Okay,,470,"Good day and please introduce yourself. My name is Kule Akonde, a representative of Freedom Synergy Pro. Thank you",11,"{""choices"": [""Male"", ""Female""]}",English,Good,,176,Nigeria,Lagos,NigeriaInfoLagos,2021-02-01T11.55.01
rwanda_kigali_RadioRwanda_2021-01-29T03.05.01_3.wav,chi ha nagita zk hang iw you say y i'm,A female in anywhere we got out the taichin a note nineteen o one in committee as a weapon to a,"
",<UNKNOWN> ,18,Male,Non-English,Good,,430,,3,Male,Non-English,Good,,50,Rwanda,Kigali,RadioRwanda,2021-01-29T03.05.01
nigeria_abeokuta_OgunRadioFM_2021-09-03T11.05.01_17.wav,the football association has called on fifa to investigate the chant which were aimed at rahim stelling and jude bellingham and world football's governing body is awaiting a report from officials who are present at the,Different but secession has connotating mitigates the chant which were aimed at raselli in due belonged footballs copepoda is awaiting report from officials who are present are the,"The football association has called on FIFA to investigate the chance, which were aimed at raheem, sterling and jude Bellingham and World Football's governing body, is awaiting a report from officials who were present at the.
",The football association has called FIFA to investigate the chance which were aimed at Raheem <UNKNOWN> and Jude <UNKNOWN> on <UNKNOWN> football governing body is awaiting a <UNKNOWN> official who are present at the <TRUNC>,16,Female,English,Bad,,560,The football association has called on FIFA to investigate the chants which were aimed at Rahim Sterling and Jude Bellingham and world football's governing body is awaiting a report from officials who were present at the,4,Female,English,Good,,143,Nigeria,Abeokuta,OgunRadioFM,2021-09-03T11.05.01
south_africa_durban_VumaFM_2021-02-03T04.00.01_8.wav,c and if this is a kind of clean government that he's talking about then really the department as well as this province he's on a slippery slope when it comes to,And this is the kind of thing government that is talking about the really the department any well as the problem is on a separate to,"Office and if this is a kind of clean government that he's talking about, then really the department, as well as this province, is on a slippery slope when it comes to.
","<TRUNC> and if this is the kind of clean government that he's talking about, then really, the department as well as this problem is on a separate flow when it comes to",4,Male,English,Okay,,409,<UNKNOWN> and if this is the kind of thing umm that that he is talking about then really the department as well as this government is on a slippery slope when it comes to,1,,,,,6,South Africa,Durban,VumaFM,2021-02-03T04.00.01
rwanda_kigali_RadioRwanda_2021-08-08T20.20.01_3.wav,osugi huma las gamba wu an did y go him,All the singing of that alison always you his in the you you amid,"You Go at him!
",,12,Male,Non-English,Good,,225,<UNKNOWN>,16,Male,Non-English,Good,,537,Rwanda,Kigali,RadioRwanda,2021-08-08T20.20.01
